{
  "$schema": "https://questfoundry.liesdonk.nl/v1/schemas/art/render_record.schema.json",
  "kind": "image",
  "path": "renders/cover.png",
  "checksum": {
    "algo": "sha256",
    "value": "ffffffffffffffffffffffffffffffffffffffffffffffffffffffffffffffff"
  },
  "generator": {
    "engine": "a1111",
    "model": "sdxl-1.0",
    "model_hash": "abc123deadbeef",
    "seed": 424242,
    "params": {
      "sampler": "DPM++ 2M",
      "steps": 30,
      "cfg": 7.0
    }
  },
  "prompt": {
    "version": "art_phase_renderer.v1",
    "positive": "retro cargo ship at gate twelve",
    "negative": "lowres",
    "language": "en"
  },
  "refs": {
    "section_id": "S-000",
    "codex_id": "CDX.STATION"
  },
  "provenance": {
    "created_at": "2025-10-27T11:00:00Z",
    "created_by": "art-renderer:v1"
  }
}
